{
  "$schema": "https://json-schema.org/draft/2020-12/schema",
  "$id": "https://raw.githubusercontent.com/mcp-wellknown/mcp-wellknown/main/schemas/mcp-wellknown.schema.json",
  "title": "MCP .well-known discovery document",
  "description": "Domain-level self-declared discovery metadata for Model Context Protocol servers, published at https://<domain>/.well-known/mcp.json. This is a community reference proposal; it will track the official specification as capability discovery is standardized.",
  "type": "object",
  "required": ["name", "spec_version", "servers"],
  "additionalProperties": false,
  "properties": {
    "$schema": {
      "type": "string",
      "description": "Optional URI of the JSON Schema this document conforms to."
    },
    "name": {
      "type": "string",
      "minLength": 1,
      "maxLength": 200,
      "description": "Human-readable name of the publisher (organization or product)."
    },
    "description": {
      "type": "string",
      "maxLength": 2000,
      "description": "Short description of what the published MCP servers offer."
    },
    "version": {
      "type": "string",
      "minLength": 1,
      "description": "Version of this discovery document (semantic versioning, e.g. 1.2.0)."
    },
    "spec_version": {
      "type": "string",
      "minLength": 1,
      "description": "Model Context Protocol specification revision the servers target, as a date-based revision (e.g. 2025-06-18)."
    },
    "servers": {
      "type": "array",
      "minItems": 1,
      "description": "MCP servers exposed by this domain.",
      "items": { "$ref": "#/$defs/server" }
    },
    "contact": {
      "type": "string",
      "minLength": 1,
      "description": "Contact for the publisher: a mailto: URI or an https:// URL."
    },
    "updated_at": {
      "type": "string",
      "description": "ISO 8601 timestamp of the last update to this document (e.g. 2026-07-01T12:00:00Z)."
    }
  },
  "$defs": {
    "server": {
      "type": "object",
      "required": ["name", "endpoint", "transport"],
      "additionalProperties": false,
      "properties": {
        "name": {
          "type": "string",
          "minLength": 1,
          "maxLength": 200,
          "description": "Identifier for this server, unique within the document."
        },
        "description": {
          "type": "string",
          "maxLength": 2000,
          "description": "Short description of this server."
        },
        "endpoint": {
          "type": "string",
          "format": "uri",
          "description": "HTTPS URL of the MCP endpoint."
        },
        "transport": {
          "type": "string",
          "enum": ["streamable-http", "sse"],
          "description": "Transport protocol offered at the endpoint."
        },
        "authentication": { "$ref": "#/$defs/authentication" },
        "capabilities": { "$ref": "#/$defs/capabilities" },
        "docs": {
          "type": "string",
          "format": "uri",
          "description": "URL of human-readable documentation for this server."
        }
      }
    },
    "authentication": {
      "type": "object",
      "required": ["type"],
      "additionalProperties": false,
      "description": "How clients authenticate against the endpoint.",
      "properties": {
        "type": {
          "type": "string",
          "enum": ["none", "oauth2", "bearer"],
          "description": "Authentication scheme."
        },
        "scopes": {
          "type": "array",
          "items": { "type": "string", "minLength": 1 },
          "uniqueItems": true,
          "description": "OAuth 2.0 scopes the client should request."
        },
        "authorization_server": {
          "type": "string",
          "format": "uri",
          "description": "OAuth 2.0 authorization server issuer URL (for type: oauth2)."
        }
      }
    },
    "capabilities": {
      "type": "object",
      "additionalProperties": false,
      "description": "Advertised server-side MCP capabilities (client-side capabilities such as sampling are not declared here). Each entry is either a boolean or a list of feature names (e.g. tool names).",
      "properties": {
        "tools": { "$ref": "#/$defs/capability" },
        "resources": { "$ref": "#/$defs/capability" },
        "prompts": { "$ref": "#/$defs/capability" },
        "completions": { "$ref": "#/$defs/capability" },
        "logging": { "$ref": "#/$defs/capability" }
      }
    },
    "capability": {
      "oneOf": [
        { "type": "boolean" },
        {
          "type": "array",
          "items": { "type": "string", "minLength": 1 },
          "uniqueItems": true
        }
      ]
    }
  }
}
